{
  "run_id": "P04__B-vanilla__2026-06-07T21-46-54Z",
  "prompt_id": "P04",
  "system_id": "B-vanilla",
  "experiment": "B",
  "timestamp": "2026-06-07T21:46:54.252443+00:00",
  "generation_model_version": "claude-sonnet-4-6",
  "config_hash": "sha256:dece59affc3820b9",
  "document_set_hash": "sha256:6d74de00858436eceb3d6092f6668c4b9ab8155faf97241eefcb221459c91d86",
  "output": {
    "answer": "Based on the context provided, **I cannot answer this question definitively**. The documents do not contain:\n\n1. **Historical case volume data** that would allow comparison of case numbers before and after any policy change to identify a pre-existing trend.\n2. **Any explicit reference to a \"new citation policy\"** being implemented \u2014 the March 5, 2026 memorandum describes the *current* enforcement process, but does not indicate it is newly adopted or changed from a prior policy.\n3. **Any causal analysis** linking citation policy changes to case volume increases.\n\nWhat the context *does* show is a **snapshot of current enforcement activity** \u2014 for example, 33 code enforcement cases related to homeless concerns on private property in one reporting period, and weekly service request logs \u2014 but **no trend data or policy change timeline** is provided that would support a conclusion about causation or whether a trend predated any policy shift.\n\nTo properly answer this question, one would need historical case volume data spanning multiple periods and documentation of when any policy changes took effect.",
    "cited_sources": [],
    "extracted_data": null,
    "retrieved_chunk_ids": [
      "95550#0",
      "95762#6",
      "95340#40",
      "95331#45",
      "95738#0",
      "95750#0",
      "95583#0",
      "95300#0"
    ]
  },
  "error": null
}