{
  "run_id": "P08__B-vanilla__2026-06-07T21-52-41Z",
  "prompt_id": "P08",
  "system_id": "B-vanilla",
  "experiment": "B",
  "timestamp": "2026-06-07T21:52:41.842210+00:00",
  "generation_model_version": "claude-sonnet-4-6",
  "config_hash": "sha256:dece59affc3820b9",
  "document_set_hash": "sha256:6d74de00858436eceb3d6092f6668c4b9ab8155faf97241eefcb221459c91d86",
  "output": {
    "answer": "## Affordable Housing & Rent Trends in the Reno MSA\n\nBased on the context provided, here is what the data shows:\n\n### Rising Rents\nRents have been climbing steadily and persistently:\n- **February 2026**: Average rent for all apartment types reached **$1,769**, up **8.4% ($137) over-the-year**\n- **January 2026**: Average rent was **$1,757**, up **6.6% ($112) over-the-year**\n- Rents have now increased for **12 consecutive months** as of February 2026\n\n### Housing Supply Constraints\nThe context indicates supply is **not keeping pace**:\n- Inventory remained tight at just **2.0 months of supply** for single-family homes and condos/townhomes\n- This confirms the market remains a **seller's market** despite slower selling times\n- Homes are taking **longer to sell** (11-12 consecutive months of slower sales vs. prior year)\n\n### Broader Implications Noted\nThe reports explicitly flag that **\"rising rents and limited supply can highlight ongoing affordability challenges that affect residents' discretionary spending and workforce housing needs.\"**\n\n### Important Caveat\nThe context **does not provide specific data on affordable housing pipeline, construction starts, or new unit delivery**, so a complete assessment of whether supply is keeping pace cannot be made from this information alone.",
    "cited_sources": [],
    "extracted_data": null,
    "retrieved_chunk_ids": [
      "95542#1",
      "95644#4",
      "95312#1",
      "95644#1",
      "95542#4",
      "95644#3",
      "95542#5",
      "95542#6"
    ]
  },
  "error": null
}