{
  "run_id": "P10__A-research__2026-06-07T21-54-42Z",
  "prompt_id": "P10",
  "system_id": "A-research",
  "experiment": "A",
  "timestamp": "2026-06-07T21:54:42.253121+00:00",
  "generation_model_version": "claude-sonnet-4-6",
  "config_hash": "sha256:8c83b92ba0df0cdf",
  "document_set_hash": null,
  "output": {
    "answer": "## Competing Priorities and Tensions Across the Memos\n\nThese three memos, taken together, reveal a meaningful structural tension \u2014 though it plays out implicitly rather than through any direct conflict stated in a single document.\n\n---\n\n### Tension 1: Expanding Community Programs vs. a Staffing Deficit\n\n**MAR-013** describes the City launching a new Park Partners Pilot Program at two parks, with plans to scale it citywide if successful. This requires staff capacity to install signage, run media events, process incoming reports, engage volunteers, and deliver quarterly Council updates \u2014 all through December 2026.\n\n**JAN-010**, however, reveals that as of late 2025, the City carried **109.75 vacant FTEs** out of 1,538.50 approved positions \u2014 roughly a 7% vacancy rate. The General Fund, which typically supports Parks & Recreation operations, holds the largest share of vacancies at **73.30 FTEs**. Nineteen of those positions are frozen or unfunded, meaning they cannot simply be filled.\n\nThe memos suggest a tension here: the City is committing to new programmatic expansion (MAR-013) at the same moment its workforce is materially understaffed and subject to a multi-layer approval process just to fill existing vacancies (JAN-010). Whether Parks & Recreation has the personnel to absorb the pilot's workload is not addressed in either memo \u2014 that gap is itself a finding.\n\n---\n\n### Tension 2: Reactive Reporting vs. Proactive Engagement\n\n**JAN-004** represents the City's existing model for community input: a passive, weekly log of public records requests, media requests, and code enforcement service requests. It is purely informational and retrospective.\n\n**MAR-013** represents a deliberate move toward a *proactive* engagement model \u2014 residents are invited not just to report problems but to become repeat participants and eventually deeper program partners. This is a philosophically different approach to the same underlying challenge (residents flagging maintenance and safety issues).\n\nThe memos suggest the City is running both models simultaneously without any stated reconciliation between them. It is not clear whether the Park Partners pilot is meant to *replace*, *supplement*, or simply *parallel* the existing code enforcement and Reno Direct reporting channels referenced in JAN-004. That ambiguity could create confusion for residents and duplication of effort for staff.\n\n---\n\n### Summary of Tensions\n\n| Tension | Memos Involved |\n|---|---|\n| New program expansion vs. significant staffing vacancies | MAR-013, JAN-010 |\n| Proactive community engagement vs. existing reactive reporting systems | MAR-013, JAN-004 |\n\nBoth tensions are inferred from reading across the memos \u2014 neither is acknowledged within any single document. The memos do not resolve these questions; they surface them.",
    "cited_sources": [
      {
        "memo_id": "MAR-013",
        "title": "Park Partners Pilot Program at Oxbow and Summit Ridge Park",
        "source_url": "https://www.reno.gov/home/showpublisheddocument/95593/639093386927330000"
      },
      {
        "memo_id": "JAN-010",
        "title": "Approved Position Update",
        "source_url": "https://www.reno.gov/home/showpublisheddocument/95296/639046886640970000"
      },
      {
        "memo_id": "JAN-004",
        "title": "Weekly Reports: Public Records Requests, Media Requests, and Code Enforcement Service Requests",
        "source_url": "https://www.reno.gov/home/showpublisheddocument/95258/639038045448000000"
      }
    ],
    "extracted_data": null,
    "retrieved_chunk_ids": [
      "MAR-013",
      "JAN-010",
      "JAN-004"
    ]
  },
  "error": null
}