{
  "run_id": "P01__B-vanilla__2026-06-07T21-43-20Z",
  "prompt_id": "P01",
  "system_id": "B-vanilla",
  "experiment": "B",
  "timestamp": "2026-06-07T21:43:20.015389+00:00",
  "generation_model_version": "claude-sonnet-4-6",
  "config_hash": "sha256:dece59affc3820b9",
  "document_set_hash": "sha256:6d74de00858436eceb3d6092f6668c4b9ab8155faf97241eefcb221459c91d86",
  "output": {
    "answer": "## Current Status of Parking Revenue Recovery\n\nBased on the memos, the parking revenue recovery effort is **actively generating results** since the City of Reno reinstated access to Nevada DMV registered owner data on June 20, 2025. The cumulative collections through February 28, 2026 are:\n\n| Period | Tickets Paid | Revenue |\n|--------|-------------|---------|\n| June 20 \u2013 Dec 31, 2025 | 15,655 | $530,534.89 |\n| January 2026 | 1,295 | $48,746.21 |\n| February 2026 | 1,206 | $54,058.75 |\n| **Total** | **18,156** | **$633,339.85** |\n\nThe program has also recently **gained access to California DMV data**, expanding the ability to pursue out-of-state violators.\n\n---\n\n## The Single Biggest Blocker\n\nThe **Nevada DMV holds** \u2014 which would automatically flag unpaid citations when a vehicle owner renews their registration, creating a powerful enforcement lever \u2014 **remain unimplemented**. The software vendor (AIMS) has completed its preparation, but the effort is stalled waiting on the **Nevada Department of Public Safety to process the setup request at the state level**, with no resolution across multiple reporting periods.",
    "cited_sources": [],
    "extracted_data": null,
    "retrieved_chunk_ids": [
      "95511#0",
      "95740#0",
      "95256#0",
      "95331#45",
      "95340#38",
      "95331#30",
      "95632#39",
      "95492#2"
    ]
  },
  "error": null
}