{
  "run_id": "P05__B-vanilla__2026-06-07T21-48-44Z",
  "prompt_id": "P05",
  "system_id": "B-vanilla",
  "experiment": "B",
  "timestamp": "2026-06-07T21:48:44.981116+00:00",
  "generation_model_version": "claude-sonnet-4-6",
  "config_hash": "sha256:dece59affc3820b9",
  "document_set_hash": "sha256:6d74de00858436eceb3d6092f6668c4b9ab8155faf97241eefcb221459c91d86",
  "output": {
    "answer": "## Analysis of Reno's Homelessness Outreach Data: Is the Approach Working?\n\nThe data presents a genuinely mixed picture with several notable tensions that complicate any simple conclusion.\n\n---\n\n### Signs of Progress\n\n**Housing placements are occurring**, though modestly:\n- December 2025: 9 individuals into transitional housing\n- January 2026: 6 individuals into transitional housing\n- February 2026: 11 housing arrangements (the strongest month), with 4 individuals transitioning out of the motel program into **permanent** housing\n- March 2026: 4 housing arrangements, with 1 individual reaching permanent housing\n\nThe motel assistance program shows genuine individual success stories, including the Washoe County Guardian's Office stepping in to continue payments when city program limits were reached, suggesting adaptive problem-solving.\n\n---\n\n### Core Tension #1: Service Demand Is Growing Faster Than Placements\n\nThe total Reno Direct service requests tell a concerning story:\n\n| Month | Total Requests |\n|-------|---------------|\n| November 2025 | 296 |\n| December 2025 | 270 |\n| January 2026 | 325 |\n| February 2026 | 323 |\n| March 2026 | 351 |\n\n**Requests are trending upward overall**, reaching their highest point in March 2026, even as housing placements remain in the single digits per month. The city is placing roughly **4-11 people per month** into housing while simultaneously seeing hundreds of new service requests monthly. The pipeline of need appears to be refilling faster than it is being emptied.\n\n---\n\n### Core Tension #2: Enforcement Is Intensifying While Outreach Acceptance Remains Low\n\nEnforcement metrics are substantial and growing:\n\n- **Citations**: 201 (Dec) \u2192 151 (Jan) \u2192 91 (Feb) \u2192 176 (Mar)\n- **Arrests**: 127 (Dec) \u2192 73 (Jan) \u2192 80 (Feb) \u2192 96 (Mar)\n- **Encampment clean-ups**: ongoing every month across all periods\n\nYet the outreach interaction data repeatedly shows individuals **declining services**. Specific examples from the data:\n- Highland Avenue and Evans Avenue: 3 individuals, **0 accepted**\n- Railroad (Record to Park Street): appeared multiple times, individuals **repeatedly declined**\n- March phone call: father seeking motel assistance for himself and his son \u2014 outcome not recorded as a placement\n\nThe ratio of enforcement actions to housing placements is stark. In March alone there were **96 arrests and 176 citations** against only **4 housing arrangements**. This raises the question of whether enforcement is displacing people or creating conditions for housing stability.\n\n---\n\n### Core Tension #3: Occupied Vehicle Numbers Suggest a Persistent and Growing Sub-Population\n\nOccupied vehicle nuisance requests are the **single largest category** of service requests and are growing dramatically:\n\n| Month | Occupied Vehicle Requests |\n|-------|--------------------------|\n| November 2025 | 127 |\n| December 2025 | 129 |\n| January 2026 | 166 |\n| February 2026 | 148 |\n| March 2026 | 200 |\n\nMarch's 200 requests represent a **35% increase over February** and a **57% increase over December**. Meanwhile, occupied vehicles posted and towed remain relatively modest (e.g., 51 posted and 10 towed in January; 50 posted and 15 towed in March). This suggests the vehicle-dwelling population is growing and that posting/towing is not resolving the underlying issue.\n\n---\n\n### Core Tension #4: Trash Collection Does Not Reflect Reduced Encampment Activity\n\nYards of trash collected:\n- December 2025: 182 yards\n- January 2026: 161 yards\n- February 2026: 127 yards\n- **March 2026: 164 yards**\n\nDespite ongoing encampment clean-ups every month (including 3 large and 19 smaller in March), trash volumes remain high, suggesting encampments are **re-forming after clean-ups** rather than being permanently resolved \u2014 a pattern consistent with displacement rather than resolution.\n\n---\n\n### What the Data Cannot Tell Us\n\nThe memoranda do not provide data on **recidivism** (whether housed individuals remain housed), the **total unsheltered population size** relative to placements, or outcomes for the majority of people who decline services. Without this, it is impossible to determine whether the cumulative effect of placements is reducing the overall population.\n\n---\n\n### Summary Assessment\n\nThe data suggests the city's approach is achieving **incremental individual successes** \u2014 real people are being housed \u2014 but is **not reducing aggregate demand**. The rising service request totals, growing occupied vehicle numbers, and persistent trash volumes indicate the unsheltered population is not shrinking. The heavy reliance on enforcement alongside modest outreach acceptance rates creates a tension: enforcement may be managing visibility without addressing root causes, while outreach capacity (25 interactions in January, 41 in March) appears insufficient relative to the scale of need reflected in 325-351 monthly service requests.",
    "cited_sources": [],
    "extracted_data": null,
    "retrieved_chunk_ids": [
      "95554#0",
      "95762#0",
      "95554#2",
      "95720#0",
      "95463#0",
      "95720#1",
      "95762#1",
      "95720#2"
    ]
  },
  "error": null
}