{
  "run_id": "P01__A-research__2026-06-07T21-42-36Z",
  "prompt_id": "P01",
  "system_id": "A-research",
  "experiment": "A",
  "timestamp": "2026-06-07T21:42:36.743361+00:00",
  "generation_model_version": "claude-sonnet-4-6",
  "config_hash": "sha256:8c83b92ba0df0cdf",
  "document_set_hash": null,
  "output": {
    "answer": "## Parking Revenue Recovery: Current Status and Primary Blocker\n\n### Where Things Stand\n\nThe program is collecting money steadily but has not yet reached its full potential. Across the three memos, the cumulative picture is:\n\n- By end of December 2025: **$530,535** collected since the program restarted in June 2025 (JAN-003)\n- January 2026 added another **$48,746**, bringing the running total to **$579,281** (FEB-018)\n- February 2026 added **$54,059**, pushing the total to **$633,340** (APR-004)\n\nMonth-over-month ticket payments have been relatively consistent (roughly 1,200\u20131,300 tickets paid per month in the most recent period), suggesting the program is functioning at a stable but not accelerating pace.\n\n---\n\n### The Single Biggest Blocker: Nevada DMV Holds\n\nAcross all three memos \u2014 spanning December 2025 through February 2026 \u2014 **Nevada DMV holds remain unresolved**. This is not a new problem; it has been pending since at least June 2025 (per the curated analysis) and appears in every memo in this thread:\n\n- JAN-003 notes the hold setup is \"awaiting Dept of Public Safety processing\"\n- FEB-018 reports it is \"still pending\"\n- APR-004 confirms it is \"still pending state DPS action\"\n\nThis matters because DMV holds are a primary enforcement lever \u2014 they compel payment by tying unpaid tickets to vehicle registration renewal. Without them, the city has limited ability to pressure non-paying violators. The memos suggest this is a **state-level dependency** (the Nevada Department of Public Safety must act), meaning the city cannot resolve it unilaterally.\n\n---\n\n### A Secondary Note on California DMV\n\nBy contrast, California DMV access \u2014 which allows the city to pursue out-of-state violators \u2014 was newly obtained in January 2026 (FEB-018), though as of February 2026 the mail notification process for CA violators was still awaiting a vendor quote (APR-004). This is a forward step, but it does not substitute for the unresolved Nevada holds, which would cover the far larger share of local violators.\n\n---\n\n### Bottom Line\n\nThe memos suggest the program is recovering revenue at a steady clip (~$50K/month recently), but the **Nevada DMV hold process has been stalled at the state level for at least nine months** with no resolution in sight across any of the three memos (JAN-003, FEB-018, APR-004). Until those holds are activated, the city lacks its most powerful tool to compel payment from non-compliant local violators.",
    "cited_sources": [
      {
        "memo_id": "APR-004",
        "title": "Parking Program Updates \u2014 February 2026",
        "source_url": "https://www.reno.gov/home/showpublisheddocument/95740/639117766748100000"
      },
      {
        "memo_id": "FEB-018",
        "title": "Parking Program Updates \u2014 January 2026",
        "source_url": "https://www.reno.gov/home/showpublisheddocument/95511/639076062744270000"
      },
      {
        "memo_id": "JAN-003",
        "title": "Parking Program Updates \u2013 December 2025",
        "source_url": "https://www.reno.gov/home/showpublisheddocument/95256/639038033812430000"
      }
    ],
    "extracted_data": null,
    "retrieved_chunk_ids": [
      "APR-004",
      "FEB-018",
      "JAN-003"
    ]
  },
  "error": null
}