{
  "run_id": "P06__B-vanilla__2026-06-07T21-49-57Z",
  "prompt_id": "P06",
  "system_id": "B-vanilla",
  "experiment": "B",
  "timestamp": "2026-06-07T21:49:57.601033+00:00",
  "generation_model_version": "claude-sonnet-4-6",
  "config_hash": "sha256:dece59affc3820b9",
  "document_set_hash": "sha256:6d74de00858436eceb3d6092f6668c4b9ab8155faf97241eefcb221459c91d86",
  "output": {
    "answer": "## Mixed Signals in the Reno-Sparks Local Economy\n\nYou're right that the memos point in different directions. Here's what the context shows across the different reporting periods:\n\n---\n\n### Signs of **Weakening**\n- The **February 2026 memo** explicitly describes \"a **slowing economy with weakening momentum**\"\n- Fewer job openings and \"continued signs of potential softening\" in the labor market\n- Consumer confidence shifted toward **pessimism**, with concerns deepening about both current conditions and future expectations\n- Inflation, while moderating, risks slowing because **consumers are cutting back on spending**\n\n---\n\n### Signs of **Stability or Modest Growth**\n- The **March 2026 memo** describes a \"**moderating but still expanding economy**\"\n- Unemployment remained low with modest hiring activity across multiple reporting periods\n- Tourism showed **positive gains** in January 2026 in visitor volume, occupancy, room rates, and gaming\n- Washoe County taxable sales were **up 10.4 percent** year-over-year\n- **Real wages grew 6.4 percent** versus 3.2 percent inflation, boosting purchasing power\n\n---\n\n### Bottom Line\nThe context suggests the economy is **neither clearly improving nor clearly weakening**, but rather **transitioning** \u2014 with real wage gains and stable employment providing support, while consumer confidence, hiring activity, and spending momentum show **growing signs of softening**.",
    "cited_sources": [],
    "extracted_data": null,
    "retrieved_chunk_ids": [
      "95312#6",
      "95312#0",
      "95542#0",
      "95644#0",
      "95644#6",
      "95542#6",
      "95644#7",
      "95513#1"
    ]
  },
  "error": null
}