{
  "run_id": "P02__A-research__2026-06-07T21-43-39Z",
  "prompt_id": "P02",
  "system_id": "A-research",
  "experiment": "A",
  "timestamp": "2026-06-07T21:43:39.805179+00:00",
  "generation_model_version": "claude-sonnet-4-6",
  "config_hash": "sha256:8c83b92ba0df0cdf",
  "document_set_hash": null,
  "output": {
    "answer": "## Long-Running Issues With No Meaningful Progress, January\u2013April 2026\n\nThree issues stand out as genuinely stuck \u2014 not just slow, but showing no substantive movement across the entire four-month window.\n\n---\n\n### 1. Nevada DMV Holds on Parking Violations\n\n**What is stuck:** The city cannot place holds on Nevada-registered vehicles with unpaid parking tickets, which directly limits how much revenue it can recover. This problem was first flagged in JAN-003 (January 11), noted again in FEB-018 (February 24), and still unresolved as of APR-004 (April 14) \u2014 a span of at least five months. Every parking update memo describes the same status: \"pending state Department of Public Safety action.\" No deadline has been set, no escalation to state officials is documented, and no workaround has been implemented.\n\n**Why it matters across memos:** The city has collected $633K in parking revenue since June 2025 (APR-004), but the memos suggest that figure is constrained by the inability to enforce against Nevada plates. California DMV access was successfully obtained in January (FEB-018), which makes the Nevada stall more conspicuous \u2014 the city solved the out-of-state problem faster than the in-state one.\n\n---\n\n### 2. Seniors EngAGED ARPA Funding Cliff\n\n**What is stuck:** The ARPA-funded senior programming ends in December 2026, and no successor funding has been identified. JAN-008 (January 21) flagged this as an open action item. APR-010 (April 21) \u2014 three months later \u2014 reports exactly the same status: \"ARPA funding concludes Dec 2026; no extension funding identified.\" The language is nearly identical across both memos, which is itself a signal that nothing has moved.\n\n**Why it matters across memos:** Participation actually *declined* between the two reporting periods \u2014 from 1,720 participants in Q4 2025 (JAN-008) to 1,256 in Q1 2026 (APR-010). The memos do not explain the drop, but it adds urgency: the program is shrinking while its funding runway is also shrinking, and no plan exists to address either trend.\n\n---\n\n### 3. Boards and Commissions Persistent Vacancies\n\n**What is stuck:** Several boards have carried the same vacancies from January through April with no documented appointments. The Access Advisory Board had 6 vacancies in JAN-002 (January 11) and still had 6 vacancies in APR-013 (April 22). Ward 6 NAB had 6 vacancies in JAN-002 and still had 6 in APR-013. The Senior Residents Advisory Board had 4 vacancies in both reports.\n\n**Why it matters across memos:** JAN-002 noted that staff planned to meet individually with Council members to support timely appointments \u2014 but APR-013 shows no reduction in vacancies on the most affected boards. The memos do not confirm whether those meetings happened. This is a governance gap: boards that cannot reach quorum cannot conduct business, and the pattern suggests the recruitment process is not working.\n\n---\n\n### What These Three Have in Common\n\nAll three are blocked by factors outside the immediate control of the departments writing the memos \u2014 state-level bureaucracy (DMV holds), a funding cliff with no identified alternative (ARPA), and a Council appointment process that appears stalled (vacancies). In each case, the memos flag the problem repeatedly but document no escalation, no deadline, and no change in status. That combination \u2014 repeated flagging, zero movement, no accountability mechanism visible in the record \u2014 is what distinguishes these from issues that are simply slow.",
    "cited_sources": [
      {
        "memo_id": "APR-002",
        "title": "Clean & Safe Team Homeless Actions & Outcomes \u2014 February 2026",
        "source_url": "https://www.reno.gov/home/showpublisheddocument/95720/639114289095530000"
      },
      {
        "memo_id": "APR-004",
        "title": "Parking Program Updates \u2014 February 2026",
        "source_url": "https://www.reno.gov/home/showpublisheddocument/95740/639117766748100000"
      },
      {
        "memo_id": "APR-010",
        "title": "Reno Seniors EngAGED Quarterly Update",
        "source_url": "https://www.reno.gov/home/showpublisheddocument/95754/639123702505330000"
      },
      {
        "memo_id": "APR-011",
        "title": "Reno Direct & Service Requests Report \u2014 March 2026",
        "source_url": "https://www.reno.gov/home/showpublisheddocument/95752/639123702500100000"
      },
      {
        "memo_id": "APR-013",
        "title": "City of Reno Boards & Commissions 2026 Q4 Vacancy Report",
        "source_url": "https://www.reno.gov/home/showpublisheddocument/95758/639124654434230000"
      },
      {
        "memo_id": "APR-014",
        "title": "Clean & Safe Team Homeless Actions & Outcomes \u2014 March 2026",
        "source_url": "https://www.reno.gov/home/showpublisheddocument/95762/639124654440770000"
      },
      {
        "memo_id": "FEB-018",
        "title": "Parking Program Updates \u2014 January 2026",
        "source_url": "https://www.reno.gov/home/showpublisheddocument/95511/639076062744270000"
      },
      {
        "memo_id": "JAN-002",
        "title": "City of Reno Boards and Commissions 2025 Q3 Vacancy Report",
        "source_url": "https://www.reno.gov/home/showpublisheddocument/95257/639038034123830000"
      },
      {
        "memo_id": "JAN-003",
        "title": "Parking Program Updates \u2013 December 2025",
        "source_url": "https://www.reno.gov/home/showpublisheddocument/95256/639038033812430000"
      },
      {
        "memo_id": "JAN-008",
        "title": "Reno Seniors EngAGED Program Update",
        "source_url": "https://www.reno.gov/home/showpublisheddocument/95291/639046102085270000"
      },
      {
        "memo_id": "JAN-014",
        "title": "Monthly Economic Update: January 2026",
        "source_url": "https://www.reno.gov/home/showpublisheddocument/95312/639052803780270000"
      },
      {
        "memo_id": "JAN-015",
        "title": "December 2025 Reno Direct & Service Requests Report",
        "source_url": "https://www.reno.gov/home/showpublisheddocument/95313/639052803983630000"
      }
    ],
    "extracted_data": null,
    "retrieved_chunk_ids": [
      "APR-002",
      "APR-004",
      "APR-010",
      "APR-011",
      "APR-013",
      "APR-014",
      "FEB-018",
      "JAN-002",
      "JAN-003",
      "JAN-008",
      "JAN-014",
      "JAN-015"
    ]
  },
  "error": null
}