{
  "run_id": "P06__A-vanilla__2026-06-07T21-49-21Z",
  "prompt_id": "P06",
  "system_id": "A-vanilla",
  "experiment": "A",
  "timestamp": "2026-06-07T21:49:21.124207+00:00",
  "generation_model_version": "claude-sonnet-4-6",
  "config_hash": "sha256:fa74cb89b16268c4",
  "document_set_hash": null,
  "output": {
    "answer": "## Mixed Signals: The Local Economy in Early 2026\n\nBased on the three monthly economic update memos (January, February, and March 2026), the picture is genuinely mixed \u2014 with some indicators improving while others weaken.\n\n---\n\n### Signs of Weakness\n- **Consumer confidence** is a consistent concern. The CCI hit **84.5 in February** \u2014 its **lowest point since May 2014** \u2014 representing a **14.7-point drop year-over-year**. In January it was already down 20.4 points YoY.\n- **Job openings fell 25.6% year-over-year** (February update)\n- **Home values are slightly declining** (-0.4% YoY as of March)\n- **WARN notices** signal upcoming layoffs: Water Safety Corp (35 jobs) and SK Food Group (209 jobs) expected in April\n- Growing **uncertainty from trade policy and geopolitical tensions** (Iran conflict) noted in the March update\n\n---\n\n### Signs of Strength\n- **Tourism rebounded sharply** \u2014 January visitors hit 307,686, up **+12.3% YoY**\n- **Average weekly wages rose 6.4% YoY**, explicitly noted as **outpacing inflation**\n- **Washoe taxable sales** reached $1.1B in November, up **+10.4% YoY**\n- **Rents rising for 12 consecutive months**, suggesting housing demand remains real\n- **Unemployment remains relatively low** at 4.0%\n- CCI actually **recovered from 84.5 to 91.2** between February and March\n\n---\n\n### Bottom Line\nThe economy appears to be **moderating rather than collapsing** \u2014 the March memo itself describes it as a \"**moderating but expanding economy**.\" The labor market is stable, wages are healthy, and tourism is strong. However, the dramatic drop in consumer confidence and falling job openings are genuine warning signs, and the WARN notices suggest near-term job losses ahead.",
    "cited_sources": [],
    "extracted_data": null,
    "retrieved_chunk_ids": [
      "MAR-001#0",
      "MAR-023#0",
      "JAN-014#0",
      "MAR-009#0",
      "MAR-008#0",
      "JAN-006#0",
      "MAR-011#0",
      "FEB-011#0"
    ]
  },
  "error": null
}