{
  "run_id": "P01__A-vanilla__2026-06-07T21-42-51Z",
  "prompt_id": "P01",
  "system_id": "A-vanilla",
  "experiment": "A",
  "timestamp": "2026-06-07T21:42:51.417293+00:00",
  "generation_model_version": "claude-sonnet-4-6",
  "config_hash": "sha256:fa74cb89b16268c4",
  "document_set_hash": null,
  "output": {
    "answer": "## Parking Revenue Recovery Status\n\nBased on the context, here is a summary of the current status:\n\n### Revenue Collected Since Program Reinstatement (June 20, 2025)\nThe program has collected a **cumulative total of $633,339.85** through February 2026, across roughly 17,000+ tickets paid. Monthly collections have been running in the **$48,000\u2013$55,000 range** in recent months, well below the July 2025 peak of **$120,735.94** \u2014 which likely reflected a backlog clearing after DMV data access was restored.\n\n---\n\n### The Single Biggest Blocker: **Nevada DMV Holds Setup**\n\nThe most significant obstacle is the **pending Nevada DMV hold setup**, which is awaiting action from the **Nevada Department of Public Safety (DPS)** \u2014 a state-level approval process outside the city's direct control. This has been listed as unresolved across **multiple consecutive monthly memos** (December 2025, January 2026, and February 2026), suggesting it has been stalled for several months with no resolution in sight.\n\n> Without DMV holds in place, the city cannot effectively compel payment from delinquent vehicle owners, which directly limits revenue recovery potential.\n\nCalifornia DMV access was recently obtained, but the Nevada hold mechanism \u2014 critical for local enforcement \u2014 remains blocked.",
    "cited_sources": [],
    "extracted_data": null,
    "retrieved_chunk_ids": [
      "JAN-003#0",
      "JAN-015#0",
      "FEB-018#0",
      "APR-011#0",
      "APR-004#0",
      "MAR-016#0",
      "APR-007#0",
      "FEB-011#0"
    ]
  },
  "error": null
}