{
  "run_id": "P11__A-research__2026-06-07T21-56-04Z",
  "prompt_id": "P11",
  "system_id": "A-research",
  "experiment": "A",
  "timestamp": "2026-06-07T21:56:04.143419+00:00",
  "generation_model_version": "claude-sonnet-4-6",
  "config_hash": "sha256:8c83b92ba0df0cdf",
  "document_set_hash": null,
  "output": {
    "answer": "## Lear Theater: Pending Decisions and Why This Is Complicated\n\n### Two Separate Decisions Are in Play\n\n**1. Tree removal (near-term, operational)**\nTwo large American Linden trees on Ralston Street \u2014 described as the largest of their kind in Reno \u2014 are scheduled for removal by end of April 2026. According to FEB-002, they pose a moderate branch-failure risk and have been pruned five times since 2000 without arresting their decline. This decision appears largely settled on safety grounds, but it sits awkwardly alongside the broader community attachment to the site (see below).\n\n**2. The building's future (strategic, high-cost)**\nMAR-012 puts three options before the Council for an April 8 decision:\n- Authorize near-term **stabilization** (~$1.6M)\n- Commission a **feasibility study**\n- Form an **HRC advisory subcommittee**\n\nThe longer-horizon cost estimates are substantial: roughly **$22M** to convert the theater to a performing arts venue, or **$18M** for a flexible events space. No funding source is identified in the memos.\n\n---\n\n### What Makes This Complicated\n\n**Strong community investment, unclear mandate.** MAR-012 reports 180 attendees at the January community meeting and 441 survey responses \u2014 signals of unusually high public interest. But high turnout doesn't resolve *what* the community wants: the memo notes two meaningfully different end-states ($18M vs. $22M), suggesting no clear consensus on use.\n\n**Two decisions on different timelines are running in parallel.** The tree removal (FEB-002, deadline April 2026) will happen *before* or *concurrent with* the Council's strategic decision on the building (MAR-012, April 8). Removing the trees changes the site permanently while the bigger question remains open \u2014 a sequencing tension the memos don't resolve.\n\n**Cost scale vs. decision stage.** The Council is being asked in April to authorize stabilization and a feasibility study, not a full commitment \u2014 but the $1.6M stabilization spend only makes sense if there's a plausible path to the $18\u201322M full investment. The memos don't indicate whether that funding exists or is being sought.\n\n**Institutional complexity.** The Historic Resources Commission (HRC) is involved and recommending a subcommittee (MAR-012), suggesting the building likely has historic significance that constrains what can be done with or to it \u2014 though the memos don't spell out those constraints explicitly.\n\n---\n\n### Bottom Line\n\nThe memos suggest the Council faces a classic \"spend now to keep options open\" dilemma: commit ~$1.6M to stabilization without knowing whether $18\u201322M will ever materialize, while a separate, smaller but symbolically charged decision (the trees) closes out on its own track. Community pressure is high (MAR-012), but the financial and strategic path forward remains unresolved.",
    "cited_sources": [
      {
        "memo_id": "FEB-002",
        "title": "Planned Tree Removals at Lear Theater",
        "source_url": "https://www.reno.gov/home/showpublisheddocument/95341/639056480242370000"
      },
      {
        "memo_id": "MAR-012",
        "title": "Update on Lear Community Meeting and Survey",
        "source_url": "https://www.reno.gov/home/showpublisheddocument/95595/639093344509200000"
      }
    ],
    "extracted_data": null,
    "retrieved_chunk_ids": [
      "FEB-002",
      "MAR-012"
    ]
  },
  "error": null
}