{
  "run_id": "P10__B-vanilla__2026-06-07T21-55-30Z",
  "prompt_id": "P10",
  "system_id": "B-vanilla",
  "experiment": "B",
  "timestamp": "2026-06-07T21:55:30.616816+00:00",
  "generation_model_version": "claude-sonnet-4-6",
  "config_hash": "sha256:dece59affc3820b9",
  "document_set_hash": "sha256:6d74de00858436eceb3d6092f6668c4b9ab8155faf97241eefcb221459c91d86",
  "output": {
    "answer": "Based on the context provided, here are several areas where the memos reveal competing priorities or tensions:\n\n## Economic Tensions\n\n**Wage Growth vs. Inflation**\nThe memos acknowledge that while wage growth outpacing inflation is positive for workers and taxable sales, inflation itself \"erodes consumer purchasing power and increases production costs for businesses.\" Higher wages are simultaneously good for consumer spending and potentially problematic for business costs.\n\n**Consumer Confidence vs. Economic Indicators**\nThe January 2026 memo describes \"mixed signals\" \u2014 modest growth alongside elevated uncertainty \u2014 suggesting tension between headline economic stability and underlying consumer pessimism. The December 2025 CCI of 89.1 (a 20.4-point year-over-year decline) sits in tension with otherwise stable labor market data.\n\n## Housing Market Tensions\n\nThe memos note stable home prices alongside slower sales activity and a seasonal slowdown, suggesting tension between price stability (favorable for existing owners) and affordability/accessibility (relevant to the master plan's attainable housing requirements under AB 540).\n\n## Planning and Development Tensions\n\nThe development project timeline memo explicitly acknowledges tension between **statutory review deadlines** (set by NRS and RMC) and **flexible scheduling needs**, noting that fixed NAB meeting schedules \"significantly limit the city's discretion\" \u2014 creating friction between legal compliance and responsive governance.\n\nThese tensions appear most clearly across the economic and planning documents reviewed.",
    "cited_sources": [],
    "extracted_data": null,
    "retrieved_chunk_ids": [
      "95542#0",
      "95644#0",
      "95312#0",
      "95652#0",
      "95644#6",
      "95513#27",
      "95642#0",
      "95312#5"
    ]
  },
  "error": null
}